{
  "schema_version": "aprof.diagnosis-problem-expansion/v1",
  "task_id": "raw15-case-03",
  "context_hash": "sha256:fcc70e688c07c9017155d002cee20218aa8e45fd3a534e945ccdb50465b6f4a5",
  "knowledge_hash": "sha256:484e2107fbff032161df166d17b7be3b4ace2a34b8f98a843a1d9a629d0f3dc5",
  "graph_version": "v0005",
  "source_context_ref": {
    "path": "origin.json",
    "sha256": "sha256:e43cd395dd4dec31c36cb58565d3af33fb796ebb729ddbebe5a8d94ac2463540"
  },
  "retrieval_hash": "sha256:f3e52596023c1f20122491b277020679b657e7d03c3afba73ca28b30ebeb19ca",
  "request_hash": "sha256:b7fa4fe4c2a193dbeff81a6f7c1d877c967dc12551215af38e0bdd45ee5dba85",
  "request": {
    "schema_version": "aprof.diagnosis-problem-expansion-request/v1",
    "task_id": "raw15-case-03",
    "context_hash": "sha256:fcc70e688c07c9017155d002cee20218aa8e45fd3a534e945ccdb50465b6f4a5",
    "knowledge_hash": "sha256:484e2107fbff032161df166d17b7be3b4ace2a34b8f98a843a1d9a629d0f3dc5",
    "graph_version": "v0005",
    "source_context_ref": {
      "path": "origin.json",
      "sha256": "sha256:e43cd395dd4dec31c36cb58565d3af33fb796ebb729ddbebe5a8d94ac2463540"
    },
    "retrieval_hash": "sha256:f3e52596023c1f20122491b277020679b657e7d03c3afba73ca28b30ebeb19ca",
    "selections": [
      {
        "problem_id": "problem.onchip_capacity_pressure",
        "reason": "xf/mf/of三片FP32缓冲以及int8中间half，比较生命周期复用。",
        "trigger": "observation_match",
        "related_problem_ids": [],
        "unexplained_observations": [
          "source.current_kernel"
        ]
      },
      {
        "problem_id": "problem.redundant_cast",
        "reason": "int8经half到float两跳是API路径还是冗余；FP32 ToFloat是乘1。",
        "trigger": "observation_match",
        "related_problem_ids": [],
        "unexplained_observations": [
          "source.current_kernel"
        ]
      },
      {
        "problem_id": "problem.pipeline_serialization",
        "reason": "多输入单槽搬运可重叠，但double slot额外字节可能压缩tile。",
        "trigger": "observation_match",
        "related_problem_ids": [],
        "unexplained_observations": [
          "source.current_kernel"
        ]
      }
    ]
  },
  "entries": [
    {
      "problem_id": "problem.onchip_capacity_pressure",
      "reason": "xf/mf/of三片FP32缓冲以及int8中间half，比较生命周期复用。",
      "trigger": "observation_match",
      "related_problem_ids": [],
      "unexplained_observations": [
        "source.current_kernel"
      ],
      "title": "同时存活区间限制片上容量",
      "mechanism": "按dtype、对齐和深度求出的同时存活物理字节接近合法可用容量 → 余量不足迫使tile/流水深度收缩或中间结果外溢 → 更短tile、额外搬运或无法建立重叠会增加执行成本",
      "scope": {
        "dtypes": [
          "all"
        ],
        "platforms": [
          "all"
        ],
        "workloads": [
          "all"
        ]
      },
      "slots": [
        {
          "description": "同时存活的UB/L1/L0 buffer集合及其分配阶段",
          "kind": "object",
          "name": "target",
          "required": true
        },
        {
          "description": "host容量预算；kernel分配、重叠与释放",
          "kind": "stage",
          "name": "stage",
          "required": true
        },
        {
          "description": "绑定shape、dtype、layout、feature与有效元素域，不跨workload借证据",
          "kind": "workload",
          "name": "workload",
          "required": true
        },
        {
          "description": "绑定当前parent源码、host/tiling/kernel、编译配置或artifact身份",
          "kind": "implementation",
          "name": "implementation",
          "required": true
        }
      ],
      "analysis": {
        "actions": [
          {
            "action_id": "action.reuse_disjoint_onchip_buffers",
            "costs": [
              "增加alias、阶段完成与所有权审计成本",
              "将来增加跨阶段重叠会使原复用失效并需重规划"
            ],
            "intervention": "让生命周期确实不重叠的片上临时区共享物理空间",
            "requirements": [
              "symptom.source.ub_live_bytes_near_capacity=true",
              "constraint.semantic_equivalence=true",
              "constraint.capacity=true",
              "constraint.dependency_lifetime=true"
            ]
          }
        ],
        "alternatives": [
          {
            "check": "分别检查InitBuffer/地址表与编译spill报告",
            "distinction": "片上UB/L1/L0与Scalar寄存器/栈是不同资源",
            "problem_id": "problem.register_spill"
          },
          {
            "check": "先容量闭合，再检查可重叠依赖",
            "distinction": "容量不足可能阻止双缓冲，也可能容量足够但事件串行",
            "problem_id": "problem.pipeline_serialization"
          }
        ],
        "counter_checks": [
          "接近容量但没有造成额外成本，只是风险形态而非已证瓶颈",
          "当前同时存活峰值明显低于可用预算或alias已正确复用则降低本项"
        ],
        "limits": [
          "资源上限、保留区和对齐取目标平台查询值",
          "不能把节省buffer直接等同于时延收益",
          "本轮无同任务profile、无case_support、无收益或发生频率声明；源码形态只支持待核验候选。"
        ],
        "mechanism_chain": [
          "按dtype、对齐和深度求出的同时存活物理字节接近合法可用容量",
          "余量不足迫使tile/流水深度收缩或中间结果外溢",
          "更短tile、额外搬运或无法建立重叠会增加执行成本"
        ],
        "objects_and_stages": [
          "同时存活的UB/L1/L0 buffer集合及其分配阶段",
          "host容量预算",
          "kernel分配、重叠与释放"
        ],
        "predictions": [
          "非重叠生命周期复用可降低物理峰值并放宽tile/流水可行域；这是prediction"
        ],
        "supporting_checks": [
          "用max_t(sum(aligned_bytes_i*depth_i))计算峰值，不能把所有声明简单相加",
          "复用审查覆盖异步消费者、跨stage事件和scratch，而非仅C++作用域"
        ]
      },
      "claims": [
        {
          "basis": "legacy_seed",
          "id": "legacy_seed",
          "limitations": [
            "旧值仅供历史审计与旧快照回放，不是本轮可靠性、概率或收益标定"
          ],
          "review_status": "reviewed",
          "source_indexes": [
            0
          ],
          "text": "原种子：同时存活区间限制片上容量；原learning={\"bias\": 0}；独立可核验证据匹配增益为 1；机制与动作不加先验偏置。"
        },
        {
          "basis": "source_statement",
          "id": "source_resources",
          "limitations": [
            "仅陈述该固定修订来源内容；不证明当前任务实现、性能或目标硬件支持"
          ],
          "review_status": "reviewed",
          "source_indexes": [
            1,
            2,
            3
          ],
          "text": "FA资源设计按同时存活buffer、queue深度与对齐验算容量；workspace按真实并发槽位和运行时shape分配，host与kernel模型必须一致。"
        },
        {
          "basis": "source_statement",
          "id": "source_resident",
          "limitations": [
            "仅陈述该固定修订来源内容；不证明当前任务实现、性能或目标硬件支持"
          ],
          "review_status": "reviewed",
          "source_indexes": [
            4,
            5
          ],
          "text": "arch35文档区分跨迭代常驻与串行阶段分时复用，并要求重叠流水发生变化时重算生命周期。"
        },
        {
          "basis": "source_statement",
          "id": "source_init",
          "limitations": [
            "仅陈述该固定修订来源内容；不证明当前任务实现、性能或目标硬件支持"
          ],
          "review_status": "reviewed",
          "source_indexes": [
            6
          ],
          "text": "InitBuffer文档定义num为物理内存块数、len以字节计且内部按32字节向上对齐。"
        },
        {
          "basis": "source_statement",
          "id": "source_liveness",
          "limitations": [
            "仅陈述该固定修订来源内容；不证明当前任务实现、性能或目标硬件支持"
          ],
          "review_status": "reviewed",
          "source_indexes": [
            7,
            8,
            9
          ],
          "text": "存活分析文档要求沿计算链核算物理峰值，融合可能增加同时活着的输入和多消费者输出，必要时主动拆链。"
        },
        {
          "basis": "mechanism_inference",
          "id": "mechanism_1",
          "limitations": [
            "资源上限、保留区和对齐取目标平台查询值",
            "不能把节省buffer直接等同于时延收益"
          ],
          "review_status": "reviewed",
          "source_indexes": [
            1,
            2,
            3,
            4,
            5,
            6,
            7,
            8,
            9
          ],
          "text": "按dtype、对齐和深度求出的同时存活物理字节接近合法可用容量"
        },
        {
          "basis": "mechanism_inference",
          "id": "mechanism_2",
          "limitations": [
            "资源上限、保留区和对齐取目标平台查询值",
            "不能把节省buffer直接等同于时延收益"
          ],
          "review_status": "reviewed",
          "source_indexes": [
            1,
            2,
            3,
            4,
            5,
            6,
            7,
            8,
            9
          ],
          "text": "余量不足迫使tile/流水深度收缩或中间结果外溢"
        },
        {
          "basis": "mechanism_inference",
          "id": "mechanism_3",
          "limitations": [
            "资源上限、保留区和对齐取目标平台查询值",
            "不能把节省buffer直接等同于时延收益"
          ],
          "review_status": "reviewed",
          "source_indexes": [
            1,
            2,
            3,
            4,
            5,
            6,
            7,
            8,
            9
          ],
          "text": "更短tile、额外搬运或无法建立重叠会增加执行成本"
        },
        {
          "basis": "mechanism_inference",
          "id": "prediction_1",
          "limitations": [
            "尚无同scope profiling验证，不标为observed或case_support"
          ],
          "review_status": "reviewed",
          "source_indexes": [
            1,
            2,
            3,
            4,
            5,
            6,
            7,
            8,
            9
          ],
          "text": "非重叠生命周期复用可降低物理峰值并放宽tile/流水可行域；这是prediction"
        },
        {
          "basis": "mechanism_inference",
          "id": "check_1",
          "limitations": [
            "这是判别程序定义，执行结果由任务证据填充"
          ],
          "review_status": "reviewed",
          "source_indexes": [
            1,
            2,
            3,
            4,
            5,
            6,
            7,
            8,
            9
          ],
          "text": "用max_t(sum(aligned_bytes_i*depth_i))计算峰值，不能把所有声明简单相加"
        },
        {
          "basis": "mechanism_inference",
          "id": "check_2",
          "limitations": [
            "这是判别程序定义，执行结果由任务证据填充"
          ],
          "review_status": "reviewed",
          "source_indexes": [
            1,
            2,
            3,
            4,
            5,
            6,
            7,
            8,
            9
          ],
          "text": "复用审查覆盖异步消费者、跨stage事件和scratch，而非仅C++作用域"
        },
        {
          "basis": "mechanism_inference",
          "id": "check_3",
          "limitations": [